{
  "schemaVersion": "trama.ecosystem.state/v0.3",
  "asOf": "2026-10-17",
  "authorityPolicy": {
    "graphState": "this-document",
    "capabilityLifecycle": "status/ecosystem-status.json",
    "maturity": "governance/maturity/trama-maturity-reconciliation-v1.json",
    "evidence": "reference-only",
    "projection": "control-center/data/ecosystem-snapshot.json",
    "autoPromotion": false
  },
  "legend": {
    "states": {
      "REAL": "Implementato e dimostrato entro il confine dichiarato.",
      "PARTIAL": "Implementazione esistente ma confine incompleto o solo parzialmente dimostrato.",
      "DESIGNED": "Confine approvato/definito ma non dimostrato a runtime.",
      "DEFERRED": "Esplicitamente differito da decisione governata."
    }
  },
  "externalActors": [
    {
      "id": "public",
      "label": "Pubblico",
      "kind": "HUMAN_ACTOR"
    }
  ],
  "nodes": [
    {
      "id": "gateway",
      "label": "TRAMA Gateway",
      "plane": "PUBLIC",
      "state": "REAL",
      "targetState": "REAL",
      "boundary": "Ingresso pubblico TRAMA implementato entro il confine pubblico sicuro.",
      "authorityOwner": "trama",
      "authorityRefs": [
        "path:docs/superpowers/specs/2026-10-17-trama-ecosystem-state-v0.3-design.md"
      ],
      "implementationOwners": [
        "trama"
      ],
      "maturityRef": null,
      "evidenceRefs": [
        "path:governance/access/trama-ecosystem-state-v0.2.json"
      ],
      "blockerRefs": [],
      "gap": {
        "summary": "none",
        "missing": []
      },
      "target": {
        "boundary": "Ingresso pubblico TRAMA governato e pubblico.",
        "value": "Ingresso pubblico coerente e sicuro"
      },
      "nextAllowedIntervention": {
        "action": "NONE",
        "preconditions": [],
        "forbiddenUntil": []
      },
      "sourceRefs": [
        "path:governance/access/trama-ecosystem-state-v0.2.json",
        "path:docs/superpowers/specs/2026-10-17-trama-ecosystem-state-v0.3-design.md"
      ],
      "lastSignificantChange": null,
      "decisionRefs": []
    },
    {
      "id": "trama_access",
      "label": "TRAMA Access",
      "plane": "PROFESSIONAL",
      "state": "PARTIAL",
      "targetState": "REAL",
      "boundary": "Runtime professionale e store privato esistono, ma il viaggio live professionale non è ancora provato end-to-end.",
      "authorityOwner": "trama",
      "authorityRefs": [
        "path:docs/superpowers/specs/2026-10-17-trama-ecosystem-state-v0.3-design.md"
      ],
      "implementationOwners": [
        "trama"
      ],
      "maturityRef": null,
      "evidenceRefs": [
        "path:docs/evidence/access-01/trama-access-state-promotion-v0.3-2026-10-17.md"
      ],
      "blockerRefs": [],
      "gap": {
        "summary": "Runtime professionale e store privato esistono, ma il viaggio live professionale non è ancora provato end-to-end.",
        "missing": [
          "identità professionale pilota autorizzata",
          "sessione live governata",
          "prova launcher live"
        ]
      },
      "target": {
        "boundary": "Login e launcher professionale canonico TRAMA.",
        "value": "Ingresso professionale unico e governato"
      },
      "nextAllowedIntervention": {
        "action": "Completare il pilota live limitato e vincolare le evidenze.",
        "preconditions": [],
        "forbiddenUntil": []
      },
      "sourceRefs": [
        "path:governance/access/trama-ecosystem-state-v0.2.json",
        "path:docs/superpowers/specs/2026-10-17-trama-ecosystem-state-v0.3-design.md"
      ],
      "lastSignificantChange": "2026-10-17",
      "decisionRefs": []
    },
    {
      "id": "professional_identity",
      "label": "Identità professionale TRAMA",
      "plane": "PROFESSIONAL",
      "state": "PARTIAL",
      "targetState": "REAL",
      "boundary": "Contratto provider-neutral e infrastruttura provider live esistono; nessuna identità professionale live governata è ancora dimostrata.",
      "authorityOwner": "trama",
      "authorityRefs": [
        "path:docs/superpowers/specs/2026-10-17-trama-ecosystem-state-v0.3-design.md"
      ],
      "implementationOwners": [
        "trama"
      ],
      "maturityRef": null,
      "evidenceRefs": [
        "path:docs/evidence/access-01/trama-access-state-promotion-v0.3-2026-10-17.md"
      ],
      "blockerRefs": [],
      "gap": {
        "summary": "Contratto provider-neutral e infrastruttura provider live esistono; nessuna identità professionale live governata è ancora dimostrata.",
        "missing": [
          "identità professionale autorizzata",
          "prova issuer+subject live"
        ]
      },
      "target": {
        "boundary": "Identità professionale TRAMA governata e minimizzata.",
        "value": "Identità professionale riusabile senza duplicazioni"
      },
      "nextAllowedIntervention": {
        "action": "Completare una singola identità professionale pilota autorizzata.",
        "preconditions": [],
        "forbiddenUntil": []
      },
      "sourceRefs": [
        "path:governance/access/trama-ecosystem-state-v0.2.json",
        "path:docs/superpowers/specs/2026-10-17-trama-ecosystem-state-v0.3-design.md"
      ],
      "lastSignificantChange": "2026-10-17",
      "decisionRefs": []
    },
    {
      "id": "docente_os",
      "label": "Docente OS",
      "plane": "PROFESSIONAL",
      "state": "REAL",
      "targetState": "REAL",
      "boundary": "Ambiente operativo docente reale entro il proprio confine di autorità.",
      "authorityOwner": "docente-os",
      "authorityRefs": [
        "path:docs/superpowers/specs/2026-10-17-trama-ecosystem-state-v0.3-design.md"
      ],
      "implementationOwners": [
        "docente-os"
      ],
      "maturityRef": "docente-os",
      "evidenceRefs": [
        "path:governance/access/trama-ecosystem-state-v0.2.json"
      ],
      "blockerRefs": [],
      "gap": {
        "summary": "none",
        "missing": []
      },
      "target": {
        "boundary": "Ambiente operativo docente reale e governato.",
        "value": "Operatività docente stabile"
      },
      "nextAllowedIntervention": {
        "action": "NONE",
        "preconditions": [],
        "forbiddenUntil": []
      },
      "sourceRefs": [
        "path:governance/access/trama-ecosystem-state-v0.2.json",
        "path:docs/superpowers/specs/2026-10-17-trama-ecosystem-state-v0.3-design.md"
      ],
      "lastSignificantChange": null,
      "decisionRefs": []
    },
    {
      "id": "arena",
      "label": "Arena",
      "plane": "PROFESSIONAL",
      "state": "REAL",
      "targetState": "REAL",
      "boundary": "Autorità curricolare Arena reale.",
      "authorityOwner": "arena",
      "authorityRefs": [
        "path:docs/superpowers/specs/2026-10-17-trama-ecosystem-state-v0.3-design.md"
      ],
      "implementationOwners": [
        "arena"
      ],
      "maturityRef": "arena",
      "evidenceRefs": [
        "path:governance/access/trama-ecosystem-state-v0.2.json"
      ],
      "blockerRefs": [],
      "gap": {
        "summary": "none",
        "missing": []
      },
      "target": {
        "boundary": "Autorità curricolare Arena preservata.",
        "value": "Autorità curricolare non ambigua"
      },
      "nextAllowedIntervention": {
        "action": "NONE",
        "preconditions": [],
        "forbiddenUntil": []
      },
      "sourceRefs": [
        "path:governance/access/trama-ecosystem-state-v0.2.json",
        "path:docs/superpowers/specs/2026-10-17-trama-ecosystem-state-v0.3-design.md"
      ],
      "lastSignificantChange": null,
      "decisionRefs": []
    },
    {
      "id": "curricolo_atlas",
      "label": "Curricolo Atlas",
      "plane": "CROSS_CUTTING",
      "state": "REAL",
      "targetState": "REAL",
      "boundary": "Superficie Curricolo Atlas reale; i flussi professionali restano qualificati separatamente.",
      "authorityOwner": "atlas",
      "authorityRefs": [
        "path:docs/superpowers/specs/2026-10-17-trama-ecosystem-state-v0.3-design.md"
      ],
      "implementationOwners": [
        "atlas"
      ],
      "maturityRef": "atlas",
      "evidenceRefs": [
        "path:governance/access/trama-ecosystem-state-v0.2.json"
      ],
      "blockerRefs": [],
      "gap": {
        "summary": "none",
        "missing": []
      },
      "target": {
        "boundary": "Superficie Curricolo Atlas pubblica/professionale governata.",
        "value": "Navigazione e pubblicazione curricolare"
      },
      "nextAllowedIntervention": {
        "action": "NONE",
        "preconditions": [],
        "forbiddenUntil": []
      },
      "sourceRefs": [
        "path:governance/access/trama-ecosystem-state-v0.2.json",
        "path:docs/superpowers/specs/2026-10-17-trama-ecosystem-state-v0.3-design.md"
      ],
      "lastSignificantChange": null,
      "decisionRefs": []
    },
    {
      "id": "studio_atlas",
      "label": "Studio Atlas",
      "plane": "PROFESSIONAL",
      "state": "PARTIAL",
      "targetState": "REAL",
      "boundary": "Studio Atlas esiste in forma parziale; il contratto canonico cross-product non è ancora approvato e vincolato.",
      "authorityOwner": "studio-atlas",
      "authorityRefs": [
        "path:docs/superpowers/specs/2026-10-17-trama-ecosystem-state-v0.3-design.md"
      ],
      "implementationOwners": [
        "studio-atlas"
      ],
      "maturityRef": "studio-atlas",
      "evidenceRefs": [
        "path:governance/access/trama-ecosystem-state-v0.2.json"
      ],
      "blockerRefs": [],
      "gap": {
        "summary": "Studio Atlas esiste in forma parziale; il contratto canonico cross-product non è ancora approvato e vincolato.",
        "missing": [
          "contratto canonico cross-product",
          "catena evidenziale successiva"
        ]
      },
      "target": {
        "boundary": "Studio Atlas reale entro un confine di authoring canonico.",